{
    "userId": 1533100,
    "authorName": "Barbara Sheridan",
    "from": "Barbara Sheridan &lt;bsher213@...&gt;",
    "profile": "bsher213",
    "replyTo": "LIST",
    "senderId": "hEEExfQQfGghkDMjm-8JLIYekyAmxzbVjZjDDthdsCnj688UIyEdcF0ikcjRupyLrveuRsRUaTuRmAblApLm6yDIh5YpV4FTzVu6dA-l0hpuKZc",
    "spamInfo": {
        "isSpam": false,
        "reason": "0"
    },
    "subject": "FF.net comes through at last!",
    "postDate": "1079744349",
    "msgId": 29,
    "canDelete": false,
    "contentTrasformed": false,
    "systemMessage": false,
    "headers": {
        "messageIdInHeader": "PDQwNUI5NzVELjYwNjAwQGJlbGxhdGxhbnRpYy5uZXQ+"
    },
    "prevInTopic": 0,
    "nextInTopic": 0,
    "prevInTime": 28,
    "nextInTime": 30,
    "topicId": 29,
    "numMessagesInTopic": 1,
    "msgSnippet": "For you PeaceMaker fans fanfiction.net has _finally_ put up a Peacemaker Kurogane category. I asked them months ago and they blew it off someone on the PMK lj ",
    "rawEmail": "Return-Path: &lt;bsher213@...&gt;\r\nX-Sender: bsher213@...\r\nX-Apparently-To: SHQ_Spy_Division@yahoogroups.com\r\nReceived: (qmail 57489 invoked from network); 20 Mar 2004 00:59:05 -0000\r\nReceived: from unknown (66.218.66.218)\n  by m1.grp.scd.yahoo.com with QMQP; 20 Mar 2004 00:59:05 -0000\r\nReceived: from unknown (HELO out006.verizon.net) (206.46.170.106)\n  by mta3.grp.scd.yahoo.com with SMTP; 20 Mar 2004 00:59:05 -0000\r\nReceived: from bellatlantic.net ([151.201.131.74]) by out006.verizon.net\n          (InterMail vM.5.01.06.06 201-253-122-130-106-20030910) with ESMTP\n          id &lt;20040320005904.CEIE1634.out006.verizon.net@...&gt;\n          for &lt;SHQ_Spy_Division@yahoogroups.com&gt;;\n          Fri, 19 Mar 2004 18:59:04 -0600\r\nMessage-ID: &lt;405B975D.60600@...&gt;\r\nDate: Fri, 19 Mar 2004 19:59:09 -0500\r\nUser-Agent: Mozilla/5.0 (Windows; U; Windows NT 5.1; en-US; rv:1.4) Gecko/20030624 Netscape/7.1 (ax)\r\nX-Accept-Language: en-us, en, ja\r\nMIME-Version: 1.0\r\nTo: SHQ_Spy_Division@yahoogroups.com\r\nContent-Type: text/plain; charset=ISO-8859-1; format=flowed\r\nContent-Transfer-Encoding: 7bit\r\nX-Authentication-Info: Submitted using SMTP AUTH at out006.verizon.net from [151.201.131.74] at Fri, 19 Mar 2004 18:59:03 -0600\r\nX-eGroups-Remote-IP: 206.46.170.106\r\nFrom: Barbara Sheridan &lt;bsher213@...&gt;\r\nSubject: FF.net comes through at last!\r\nX-Yahoo-Group-Post: member; u=1533100\r\nX-Yahoo-Profile: bsher213\r\n\r\nFor you PeaceMaker fans fanfiction.net has _finally_ put up a Peacemaker \nKurogane category.\n\nI asked them months ago and they blew it off someone on the PMK lj \ncommunity asks and they do it straightaway go figure  Hn\n\n-- \nBarbara Sheridan\t\n\nhttp://www.barbarasheridan.net\n\n\n\n\n"
}