{
    "userId": 1533100,
    "authorName": "Barbara Sheridan",
    "from": "Barbara Sheridan &lt;bsher213@...&gt;",
    "profile": "bsher213",
    "replyTo": "LIST",
    "senderId": "TU4tzGvd67e1j3O0mecv_wd84vASi_2TOHdK_KzM0kxvNv-crP3uC5liZB7qHD2ROUFQGnJCIdh65Bc_-VqPx8YbCTOBYudXXFKS-DJm6HUAvBc",
    "spamInfo": {
        "isSpam": false,
        "reason": "0"
    },
    "subject": "Fiction on the website",
    "postDate": "1080058217",
    "msgId": 38,
    "canDelete": false,
    "contentTrasformed": false,
    "systemMessage": false,
    "headers": {
        "messageIdInHeader": "PDQwNjA2MTY5LjUwMzAwMDBAYmVsbGF0bGFudGljLm5ldD4="
    },
    "prevInTopic": 0,
    "nextInTopic": 39,
    "prevInTime": 37,
    "nextInTime": 39,
    "topicId": 38,
    "numMessagesInTopic": 4,
    "msgSnippet": "Just wanted to let everyone know that some new things have been added to the SHQ webpage last night and this morning in the fiction section. (see link at end",
    "rawEmail": "Return-Path: &lt;bsher213@...&gt;\r\nX-Sender: bsher213@...\r\nX-Apparently-To: SHQ_Spy_Division@yahoogroups.com\r\nReceived: (qmail 19230 invoked from network); 23 Mar 2004 16:13:50 -0000\r\nReceived: from unknown (66.218.66.172)\n  by m12.grp.scd.yahoo.com with QMQP; 23 Mar 2004 16:13:50 -0000\r\nReceived: from unknown (HELO out005.verizon.net) (206.46.170.143)\n  by mta4.grp.scd.yahoo.com with SMTP; 23 Mar 2004 16:13:50 -0000\r\nReceived: from bellatlantic.net ([141.151.184.31]) by out005.verizon.net\n          (InterMail vM.5.01.06.06 201-253-122-130-106-20030910) with ESMTP\n          id &lt;20040323161022.CSAG2677.out005.verizon.net@...&gt;;\n          Tue, 23 Mar 2004 10:10:22 -0600\r\nMessage-ID: &lt;40606169.5030000@...&gt;\r\nDate: Tue, 23 Mar 2004 11:10:17 -0500\r\nUser-Agent: Mozilla/5.0 (Windows; U; Windows NT 5.1; en-US; rv:1.4) Gecko/20030624 Netscape/7.1 (ax)\r\nX-Accept-Language: en-us, en\r\nMIME-Version: 1.0\r\nTo: SHQ_Spy_Division@yahoogroups.com,  SHQ@yahoogroups.com\r\nContent-Type: text/plain; charset=ISO-8859-1; format=flowed\r\nContent-Transfer-Encoding: 7bit\r\nX-Authentication-Info: Submitted using SMTP AUTH at out005.verizon.net from [141.151.184.31] at Tue, 23 Mar 2004 10:10:21 -0600\r\nX-eGroups-Remote-IP: 206.46.170.143\r\nFrom: Barbara Sheridan &lt;bsher213@...&gt;\r\nSubject: Fiction on the website\r\nX-Yahoo-Group-Post: member; u=1533100\r\nX-Yahoo-Profile: bsher213\r\n\r\nJust wanted to let everyone know that some new things have been added to \nthe SHQ webpage last night and this morning in the fiction section. (see \nlink at end of message)  I invite you all to take a look around the \nplace and feel free to email me off list with any comments, questions or \nsuggestions\n\nhttp://www.shinsengumihq.com/spydivision.htm\n\n-- \nBarbara Sheridan\nhttp://www.barbarasheridan.net\n\n\n\n\n"
}