{
    "userId": 108589066,
    "authorName": "Shimazu Masayoshi",
    "from": "&quot;Shimazu Masayoshi&quot; &lt;patriot014@...&gt;",
    "profile": "shimazuryu",
    "replyTo": "LIST",
    "senderId": "mvNyMyqymSFKa5WKlC8NVEIF5h0gt0oMSxKQif3TzRKCRrng88rk8hcJZehOpPMuaW5TuXsWsMxvNlQ6GGRcFozLmSrcVZqK2G4hcRI1aDHoOpo",
    "spamInfo": {
        "isSpam": false,
        "reason": "0"
    },
    "subject": "Music",
    "postDate": "1080182571",
    "msgId": 61,
    "canDelete": false,
    "contentTrasformed": false,
    "systemMessage": false,
    "headers": {
        "messageIdInHeader": "PGMzdGd2YitwNGxoQGVHcm91cHMuY29tPg=="
    },
    "prevInTopic": 0,
    "nextInTopic": 0,
    "prevInTime": 60,
    "nextInTime": 62,
    "topicId": 61,
    "numMessagesInTopic": 1,
    "msgSnippet": "Alright, since Yahoo accepted that last post, let me post what I wanted to say again. With regards to Chapter 9, it s best appreciated if read while listening",
    "rawEmail": "Return-Path: &lt;patriot014@...&gt;\r\nX-Sender: patriot014@...\r\nX-Apparently-To: SHQ_Spy_Division@yahoogroups.com\r\nReceived: (qmail 467 invoked from network); 25 Mar 2004 02:43:15 -0000\r\nReceived: from unknown (66.218.66.218)\n  by m4.grp.scd.yahoo.com with QMQP; 25 Mar 2004 02:43:15 -0000\r\nReceived: from unknown (HELO n7.grp.scd.yahoo.com) (66.218.66.91)\n  by mta3.grp.scd.yahoo.com with SMTP; 25 Mar 2004 02:43:15 -0000\r\nReceived: from [66.218.67.148] by n7.grp.scd.yahoo.com with NNFMP; 25 Mar 2004 02:42:51 -0000\r\nDate: Thu, 25 Mar 2004 02:42:51 -0000\r\nTo: SHQ_Spy_Division@yahoogroups.com\r\nMessage-ID: &lt;c3tgvb+p4lh@...&gt;\r\nUser-Agent: eGroups-EW/0.82\r\nMIME-Version: 1.0\r\nContent-Type: text/plain; charset=ISO-8859-1\r\nContent-Length: 302\r\nX-Mailer: Yahoo Groups Message Poster\r\nX-eGroups-Remote-IP: 66.218.66.91\r\nFrom: &quot;Shimazu Masayoshi&quot; &lt;patriot014@...&gt;\r\nSubject: Music\r\nX-Yahoo-Group-Post: member; u=108589066\r\nX-Yahoo-Profile: shimazuryu\r\n\r\nAlright, since Yahoo accepted that last post, let me post what I\nwanted to say again.\n\nWith regards to Chapter 9, it&#39;s best appreciated if read while\nlistening to Evanescence&#39;s &quot;Whisper&quot; or &quot;Tourniquet&quot;, particularly\nduring the battle scene at the Ikeda-ya.\n\nThanks. I hope this post makes it...\n\n--M.\n\n\n"
}