{
    "userId": 108589066,
    "authorName": "Shimazu Masayoshi",
    "from": "&quot;Shimazu Masayoshi&quot; &lt;patriot014@...&gt;",
    "profile": "shimazuryu",
    "replyTo": "LIST",
    "senderId": "jUJXWpur-H0u8ZkJGwYGbamsF16JzQdx2JPsnbzCtYSUeyw3nramcldPT2uyZGDJBG_m0cU8JCk5JzbQeL9Bf-IvrmL716-C7toFoABre2fdtgE",
    "spamInfo": {
        "isSpam": false,
        "reason": "0"
    },
    "subject": "A note about my latest chapter",
    "postDate": "1080178843",
    "msgId": 63,
    "canDelete": false,
    "contentTrasformed": false,
    "systemMessage": false,
    "headers": {
        "messageIdInHeader": "PGMzdGRhcithNXUzQGVHcm91cHMuY29tPg=="
    },
    "prevInTopic": 0,
    "nextInTopic": 0,
    "prevInTime": 62,
    "nextInTime": 64,
    "topicId": 63,
    "numMessagesInTopic": 1,
    "msgSnippet": "Just a note: Chapter 9 is best appreciated if read while listening to Evanescence s Whisper -- especially during the battle scene. Thanks. --M.",
    "rawEmail": "Return-Path: &lt;patriot014@...&gt;\r\nX-Sender: patriot014@...\r\nX-Apparently-To: SHQ_Spy_Division@yahoogroups.com\r\nReceived: (qmail 43226 invoked from network); 25 Mar 2004 01:42:07 -0000\r\nReceived: from unknown (66.218.66.172)\n  by m1.grp.scd.yahoo.com with QMQP; 25 Mar 2004 01:42:07 -0000\r\nReceived: from unknown (HELO n6.grp.scd.yahoo.com) (66.218.66.90)\n  by mta4.grp.scd.yahoo.com with SMTP; 25 Mar 2004 01:42:07 -0000\r\nReceived: from [66.218.67.191] by n6.grp.scd.yahoo.com with NNFMP; 25 Mar 2004 01:40:43 -0000\r\nDate: Thu, 25 Mar 2004 01:40:43 -0000\r\nTo: SHQ_Spy_Division@yahoogroups.com\r\nMessage-ID: &lt;c3tdar+a5u3@...&gt;\r\nUser-Agent: eGroups-EW/0.82\r\nMIME-Version: 1.0\r\nContent-Type: text/plain; charset=ISO-8859-1\r\nContent-Length: 148\r\nX-Mailer: Yahoo Groups Message Poster\r\nX-eGroups-Remote-IP: 66.218.66.90\r\nFrom: &quot;Shimazu Masayoshi&quot; &lt;patriot014@...&gt;\r\nSubject: A note about my latest chapter\r\nX-Yahoo-Group-Post: member; u=108589066\r\nX-Yahoo-Profile: shimazuryu\r\n\r\nJust a note:\n\nChapter 9 is best appreciated if read while listening to Evanescence&#39;s\n&quot;Whisper&quot;-- especially during the battle scene.\n\nThanks.\n\n--M.\n\n\n"
}