{
    "userId": 108589066,
    "authorName": "Shimazu Masayoshi",
    "from": "&quot;Shimazu Masayoshi&quot; &lt;patriot014@...&gt;",
    "profile": "shimazuryu",
    "replyTo": "LIST",
    "senderId": "h0zHxn-W-eAHnz9k7eY6KzzPvuuqWI-abT0UVK4xak4E399lZF4d8d_zKrzQXGgp1onqTlNEYjNMePklGmkHpvEHRrXFPkT3WLKjEdVc-PYG5aQ",
    "spamInfo": {
        "isSpam": false,
        "reason": "0"
    },
    "subject": "Music for Jidai Monogatari Chapter 9",
    "postDate": "1080179849",
    "msgId": 64,
    "canDelete": false,
    "contentTrasformed": false,
    "systemMessage": false,
    "headers": {
        "messageIdInHeader": "PGMzdGVhOSt1OHZvQGVHcm91cHMuY29tPg=="
    },
    "prevInTopic": 0,
    "nextInTopic": 0,
    "prevInTime": 63,
    "nextInTime": 65,
    "topicId": 64,
    "numMessagesInTopic": 1,
    "msgSnippet": "Just a note-- Jidai Monogatari Chapter 9 is best read while listening to Evanescence s Whisper . Or, if you prefer, Tourniquet . ESPECIALLY during the battle",
    "rawEmail": "Return-Path: &lt;patriot014@...&gt;\r\nX-Sender: patriot014@...\r\nX-Apparently-To: SHQ_Spy_Division@yahoogroups.com\r\nReceived: (qmail 7990 invoked from network); 25 Mar 2004 01:57:34 -0000\r\nReceived: from unknown (66.218.66.216)\n  by m15.grp.scd.yahoo.com with QMQP; 25 Mar 2004 01:57:33 -0000\r\nReceived: from unknown (HELO n4.grp.scd.yahoo.com) (66.218.66.88)\n  by mta1.grp.scd.yahoo.com with SMTP; 25 Mar 2004 01:57:33 -0000\r\nReceived: from [66.218.67.151] by n4.grp.scd.yahoo.com with NNFMP; 25 Mar 2004 01:57:31 -0000\r\nDate: Thu, 25 Mar 2004 01:57:29 -0000\r\nTo: SHQ_Spy_Division@yahoogroups.com\r\nMessage-ID: &lt;c3tea9+u8vo@...&gt;\r\nUser-Agent: eGroups-EW/0.82\r\nMIME-Version: 1.0\r\nContent-Type: text/plain; charset=ISO-8859-1\r\nContent-Length: 187\r\nX-Mailer: Yahoo Groups Message Poster\r\nX-eGroups-Remote-IP: 66.218.66.88\r\nFrom: &quot;Shimazu Masayoshi&quot; &lt;patriot014@...&gt;\r\nSubject: Music for Jidai Monogatari Chapter 9\r\nX-Yahoo-Group-Post: member; u=108589066\r\nX-Yahoo-Profile: shimazuryu\r\n\r\nJust a note--\n\nJidai Monogatari Chapter 9 is best read while listening to\nEvanescence&#39;s &quot;Whisper&quot;. Or, if you prefer, &quot;Tourniquet&quot;. ESPECIALLY\nduring the battle scene.\n\nOK. Thanks!\n\n--M.\n\n\n"
}