{
    "userId": 173227807,
    "authorName": "spiritus saitou",
    "from": "spiritus saitou &lt;spiritus_saitou@...&gt;",
    "profile": "spiritus_saitou",
    "replyTo": "LIST",
    "senderId": "PPZ1s3Qa0MWhxHfW8uInqcz3_OSpSX_Dj80E0Fct8gVOFuV2R5GF57pUfGMBZjYdWVFxLrkijcomZJphihWrMAL6uo8Nr5Ljn3wR11MVYmxDwQ",
    "spamInfo": {
        "isSpam": false,
        "reason": "0"
    },
    "subject": "Delay in posts sent to the lists",
    "postDate": "1080260604",
    "msgId": 70,
    "canDelete": false,
    "contentTrasformed": false,
    "systemMessage": false,
    "headers": {
        "messageIdInHeader": "PDIwMDQwMzI2MDAyMzI0LjM4MDQ0LnFtYWlsQHdlYjIxNDAxLm1haWwueWFob28uY29tPg=="
    },
    "prevInTopic": 0,
    "nextInTopic": 0,
    "prevInTime": 69,
    "nextInTime": 71,
    "topicId": 70,
    "numMessagesInTopic": 1,
    "msgSnippet": "Have no idea when you re going to see this, but I wanted to let everyone know, I ve sent in a query to yahoo asking why we are experiencing these increasingly",
    "rawEmail": "Return-Path: &lt;spiritus_saitou@...&gt;\r\nX-Sender: spiritus_saitou@...\r\nX-Apparently-To: shq_spy_division@yahoogroups.com\r\nReceived: (qmail 13800 invoked from network); 26 Mar 2004 00:23:26 -0000\r\nReceived: from unknown (66.218.66.166)\n  by m17.grp.scd.yahoo.com with QMQP; 26 Mar 2004 00:23:25 -0000\r\nReceived: from unknown (HELO web21401.mail.yahoo.com) (216.136.232.71)\n  by mta5.grp.scd.yahoo.com with SMTP; 26 Mar 2004 00:23:24 -0000\r\nMessage-ID: &lt;20040326002324.38044.qmail@...&gt;\r\nReceived: from [130.13.110.254] by web21401.mail.yahoo.com via HTTP; Thu, 25 Mar 2004 16:23:24 PST\r\nDate: Thu, 25 Mar 2004 16:23:24 -0800 (PST)\r\nTo: shq_spy_division@yahoogroups.com, shq@yahoogroups.com\r\nMIME-Version: 1.0\r\nX-eGroups-Remote-IP: 216.136.232.71\r\nFrom: spiritus saitou &lt;spiritus_saitou@...&gt;\r\nSubject: Delay in posts sent to the lists\r\nX-Yahoo-Group-Post: member; u=173227807\r\nX-Yahoo-Profile: spiritus_saitou\r\nContent-Type: text/plain; charset=US-ASCII\r\nContent-Transfer-Encoding: 7bit\r\n\r\nHave no idea when you&#39;re going to see this, but I wanted to let everyone know, I&#39;ve sent in a query to yahoo asking why we are experiencing these increasingly frustrating delays in messages showing up both on the list sites and in personal mailboxes.  Sometimes they respond quickly, sometimes they don&#39;t.  Even if the situation clears up as soon as I&#39;ve sent this, I&#39;ve also asked them if there is someplace within yahoo where someone can check for service disruption updates.\n \nphil\n\n\n---------------------------------\nDo you Yahoo!?\nYahoo! Finance Tax Center - File online. File on time.\n\n[Non-text portions of this message have been removed]\n\n\n"
}