{
    "userId": 108589066,
    "authorName": "Shimazu Masayoshi",
    "from": "&quot;Shimazu Masayoshi&quot; &lt;patriot014@...&gt;",
    "profile": "shimazuryu",
    "replyTo": "LIST",
    "senderId": "3ckzQgYxWnBmV9oYygRX5lv2ZHQrameGfZqUeHjB_OAuKQ-_QiP8bdqFj9BEEkQ93fYUpJAQXtMUVUVYg4sj69q3zVSe_VKzT2TB1Cq67pJ6OfY",
    "spamInfo": {
        "isSpam": false,
        "reason": "0"
    },
    "subject": "FIC: (Poem)Takaramono (original, from &quot;Jidai&quot;). Saitou, Hiro, Yuki. Rating: G",
    "postDate": "1080282756",
    "msgId": 71,
    "canDelete": false,
    "contentTrasformed": false,
    "systemMessage": false,
    "headers": {
        "messageIdInHeader": "PGM0MGlxNCtuMDQwQGVHcm91cHMuY29tPg=="
    },
    "prevInTopic": 0,
    "nextInTopic": 0,
    "prevInTime": 70,
    "nextInTime": 72,
    "topicId": 71,
    "numMessagesInTopic": 1,
    "msgSnippet": "Full Title: Taisetsu na Takaramono (Precious Treasure) Author: Shimazu Masayoshi E-mail: patriot014@.*** Source: Original (Characters from Jidai",
    "rawEmail": "Return-Path: &lt;patriot014@...&gt;\r\nX-Sender: patriot014@...\r\nX-Apparently-To: SHQ_Spy_Division@yahoogroups.com\r\nReceived: (qmail 77283 invoked from network); 26 Mar 2004 06:32:50 -0000\r\nReceived: from unknown (66.218.66.217)\n  by m19.grp.scd.yahoo.com with QMQP; 26 Mar 2004 06:32:50 -0000\r\nReceived: from unknown (HELO n40.grp.scd.yahoo.com) (66.218.66.108)\n  by mta2.grp.scd.yahoo.com with SMTP; 26 Mar 2004 06:32:49 -0000\r\nReceived: from [66.218.67.187] by n40.grp.scd.yahoo.com with NNFMP; 26 Mar 2004 06:32:38 -0000\r\nDate: Fri, 26 Mar 2004 06:32:36 -0000\r\nTo: SHQ_Spy_Division@yahoogroups.com\r\nMessage-ID: &lt;c40iq4+n040@...&gt;\r\nUser-Agent: eGroups-EW/0.82\r\nMIME-Version: 1.0\r\nContent-Type: text/plain; charset=ISO-8859-1\r\nContent-Length: 2410\r\nX-Mailer: Yahoo Groups Message Poster\r\nX-eGroups-Remote-IP: 66.218.66.108\r\nFrom: &quot;Shimazu Masayoshi&quot; &lt;patriot014@...&gt;\r\nSubject: FIC: (Poem)Takaramono (original, from &quot;Jidai&quot;). Saitou, Hiro, Yuki. Rating: G\r\nX-Yahoo-Group-Post: member; u=108589066\r\nX-Yahoo-Profile: shimazuryu\r\n\r\nFull Title: Taisetsu na Takaramono (Precious Treasure)\nAuthor: Shimazu Masayoshi\nE-mail: patriot014@...\nSource: Original (Characters from &quot;Jidai Monogatari&quot;)\nMain character(s): 3rd Unit mentioned, as well as the Mori of Choshuu\nand the Tokugawa, but this poem is mainly Hiro and Yuki. Written from\nHiro&#39;s point of view. Comments/explanation are in brackets (the &quot;[]&quot;\nthingies)\nGeneral Rating: PG...it&#39;s romantic. And it&#39;s in free verse, so don&#39;t\nyell at me that it doesn&#39;t rhyme, please.\nWarning: Nothing really.\nDisclaimer: Hiro and Yuki belong to me. Saitou belongs in the national\nspirit of the Japanese people. So there. (c)2004 Shimazu Masayoshi\n\n\n\nTAISETSU NA TAKARAMONO\n\nYuki...\nSnow.\nDrifting, swirling, dancing around me\ndelicate yet commanding\ncovering the ugliness\nin this world of grief and tears\nturning everything beautiful.\nEven this pack of wolves\nI seem to be one of\nseem better and more bearable,\nsince you turn everything\ninto shirayuki\n(Snow-white)\nOr something of that sort\nin this field of flowers\nwhere we write love letters\nin the ash of life\nin the drifting snow\nthrough which you appear.\nReaching out, I draw you near me\nmy blue and white overcoat\nflutters in the wind.\nComing closer still\nyour lips part\nand a  blissful,\npowerful fire passes\nthrough us,\nas we drink deeply\nfrom the sweetness\nof the cup of romance.\nEmbrace me, my koishii [beloved]\nSoothe my troubled spirit\ntouch me with the heart\nof your snow-white beauty.\nDry my tears,\nshed in the dark\nof this tortured city\nwhere the three stars[Mori (Choshuu) crest]\nthe three hollyhocks [Tokugawa crest]\nand the white mountains [triangles on the Shinsengumi flag]\ntear each other to pieces.\nDry these tears\nwith the calm of your poet&#39;s heart.\nTake my scarred hand\nwith the strength of your warrior&#39;s spirit.\nListen as the shining bright wind\ntells the story of our true blue love.\nI have wept too long\nin this world of grief and tears\nwhere we have no home\nbut a simple hermitage\nshelter on the road\nto somewhere we used to know.\nI feel as though\nI&#39;ve lost a part of my soul\nin the streets of this city\nin these many patrols\nwith these vigilant wolves.\nFill my heart,\nLight my vision with the fire\nand glow of passion.\nKiss me, my love\nand take away my pain\nfor I&#39;ve wept too long.\nAnata wa watashi no\ntaisetsu na takaramono...\nZutto...aishiteru...\nYou are my precious treasure,\nand I love you...forever...\n***********\n\n\n"
}