{
    "userId": 108589066,
    "authorName": "Shimazu Masayoshi",
    "from": "&quot;Shimazu Masayoshi&quot; &lt;patriot014@...&gt;",
    "profile": "shimazuryu",
    "replyTo": "LIST",
    "senderId": "aW2t7i8BuzWVVxYcuh_27Z1rJXZUI7ncZxFjibRDdYfAXwZChyOPB-VYB0Hy29i1xa12JojTJJ1ZedhnXUH-T4a2v00rJO7A2rvC9gN6rr1MXgs",
    "spamInfo": {
        "isSpam": false,
        "reason": "0"
    },
    "subject": "Reasons to Join Shinsengumi/Things Saitou Would Never Do",
    "postDate": "1080357276",
    "msgId": 77,
    "canDelete": false,
    "contentTrasformed": false,
    "systemMessage": false,
    "headers": {
        "messageIdInHeader": "PGM0MnJpcyt1aHQzQGVHcm91cHMuY29tPg=="
    },
    "prevInTopic": 0,
    "nextInTopic": 0,
    "prevInTime": 76,
    "nextInTime": 78,
    "topicId": 77,
    "numMessagesInTopic": 1,
    "msgSnippet": "Reasons to join Shinsengumi 1. The Ishin suck. 2. Your han (domain) sucks, and you want to see the world. 3. Did I mention that the Ishin suck? 4. You want to",
    "rawEmail": "Return-Path: &lt;patriot014@...&gt;\r\nX-Sender: patriot014@...\r\nX-Apparently-To: SHQ_Spy_Division@yahoogroups.com\r\nReceived: (qmail 62981 invoked from network); 27 Mar 2004 03:15:01 -0000\r\nReceived: from unknown (66.218.66.166)\n  by m9.grp.scd.yahoo.com with QMQP; 27 Mar 2004 03:15:01 -0000\r\nReceived: from unknown (HELO n27.grp.scd.yahoo.com) (66.218.66.83)\n  by mta5.grp.scd.yahoo.com with SMTP; 27 Mar 2004 03:15:04 -0000\r\nReceived: from [66.218.67.176] by n27.grp.scd.yahoo.com with NNFMP; 27 Mar 2004 03:14:38 -0000\r\nDate: Sat, 27 Mar 2004 03:14:36 -0000\r\nTo: SHQ_Spy_Division@yahoogroups.com\r\nMessage-ID: &lt;c42ris+uht3@...&gt;\r\nUser-Agent: eGroups-EW/0.82\r\nMIME-Version: 1.0\r\nContent-Type: text/plain; charset=ISO-8859-1\r\nContent-Length: 1391\r\nX-Mailer: Yahoo Groups Message Poster\r\nX-eGroups-Remote-IP: 66.218.66.83\r\nFrom: &quot;Shimazu Masayoshi&quot; &lt;patriot014@...&gt;\r\nSubject: Reasons to Join Shinsengumi/Things Saitou Would Never Do\r\nX-Yahoo-Group-Post: member; u=108589066\r\nX-Yahoo-Profile: shimazuryu\r\n\r\nReasons to join Shinsengumi\n\n1. The Ishin suck.\n2. Your han (domain) sucks, and you want to see the world.\n3. Did I mention that the Ishin suck?\n4. You want to be a samurai, and can&#39;t stand carrying bushels of rice\nto the tax collector every month.\n5. You got forced in by a wolf-eyed member who threatened to kill you\nif you laughed at the word &quot;dandara&quot; again.\n6. The head of your dojo joined (glares at Okita and Hijikata)\n7. You can talk to ghosts.\n8. You have a thing for ultra-cute cook/ninja girls (looks over at\nAyu-nee with sparkly eyes).\n9. Lord Matsudaira said so.\n10. Your mother said so.\n11. Lord Matsudaira and your mother said so.\n12. You&#39;re an otaku from the 21st century who wants to travel back in\ntime with rifles and grenade launchers and burn as many Ishin as you\npossibly can (before your ammo runs out).\n13. You like free food (glares at Sano and Shinpachi).\n14. Hey, it&#39;s a living.\n15. You like little pigs.\n16. You don&#39;t mind getting chased by said pigs.\n\nThings Saitou Would Never Do/Say\n\n1. &quot;All Hail Saigou Takamori!&quot;\n2. Turn down soba.\n3. Turn down a drink.\n4. Wear Kenshin&#39;s pink gi.\n5. Write haiku.\n6. Fart-- it&#39;d mess up his &quot;cool&quot; aura.\n7. Burp-- see above for reason.\n8. Run around going &quot;Ni! Ni! Ni!&quot;\n9. Run around pretending to ride on a horse, with an armed retainer\nbehind him banging coconut halves together.\n\n\nI&#39;ll come up with more, I promise.\n\n--M.\n\n\n"
}