{
    "userId": 176343463,
    "authorName": "Tiffany",
    "from": "&quot;Tiffany&quot; &lt;makoto@...&gt;",
    "profile": "secretarytocapt3",
    "replyTo": "LIST",
    "senderId": "VnzOvZzgXDn8V5mmuF3Ambb1tSXF4B46c4bYm35FX4waNgVh5UTXPL7F-rht77q34sItOn9TcVVRkGU3842X_MW5AlIFovD9evk",
    "spamInfo": {
        "isSpam": false,
        "reason": "0"
    },
    "subject": "Shinsengumi Fiction Database",
    "postDate": "1080706668",
    "msgId": 82,
    "canDelete": false,
    "contentTrasformed": false,
    "systemMessage": false,
    "headers": {
        "messageIdInHeader": "PGM0ZGdwYytrbW9hQGVHcm91cHMuY29tPg=="
    },
    "prevInTopic": 0,
    "nextInTopic": 0,
    "prevInTime": 81,
    "nextInTime": 83,
    "topicId": 82,
    "numMessagesInTopic": 1,
    "msgSnippet": "I started a Shinsengumi Fiction Database for stories stored in fanfiction.net or elsewhere on the net.  Everyone can add records so pitch in and gather the",
    "rawEmail": "Return-Path: &lt;makoto@...&gt;\r\nX-Sender: makoto@...\r\nX-Apparently-To: SHQ_Spy_Division@yahoogroups.com\r\nReceived: (qmail 12698 invoked from network); 31 Mar 2004 04:18:09 -0000\r\nReceived: from unknown (66.218.66.216)\n  by m13.grp.scd.yahoo.com with QMQP; 31 Mar 2004 04:18:09 -0000\r\nReceived: from unknown (HELO n25.grp.scd.yahoo.com) (66.218.66.81)\n  by mta1.grp.scd.yahoo.com with SMTP; 31 Mar 2004 04:18:08 -0000\r\nReceived: from [66.218.66.116] by n25.grp.scd.yahoo.com with NNFMP; 31 Mar 2004 04:17:49 -0000\r\nDate: Wed, 31 Mar 2004 04:17:48 -0000\r\nTo: SHQ_Spy_Division@yahoogroups.com\r\nMessage-ID: &lt;c4dgpc+kmoa@...&gt;\r\nUser-Agent: eGroups-EW/0.82\r\nMIME-Version: 1.0\r\nContent-Type: text/plain; charset=ISO-8859-1\r\nContent-Length: 531\r\nX-Mailer: Yahoo Groups Message Poster\r\nX-eGroups-Remote-IP: 66.218.66.81\r\nFrom: &quot;Tiffany&quot; &lt;makoto@...&gt;\r\nSubject: Shinsengumi Fiction Database\r\nX-Yahoo-Group-Post: member; u=176343463\r\nX-Yahoo-Profile: secretarytocapt3\r\n\r\nI started a Shinsengumi Fiction Database for stories stored in\nfanfiction.net or elsewhere on the net.  Everyone can add records so\npitch in and gather the best fiction in one place:)\n\nIf you are a writer on ff.net please list your Shinsengumi/Saitou\nstories:)\n\nDue to the overwhelming number of RK stories on ff.net the Shinsengumi\nkind of get &quot;lost&quot; and so it is absolutely necessary to bring these\nstories to the forefront.\n\nIn the future, when time permits we can probably convert the database\nto html/links for the SHQ page.\n\n\n\n"
}