{
    "userId": 182392907,
    "authorName": "Tiffany",
    "from": "&quot;Tiffany&quot; &lt;secretarytocapt3@...&gt;",
    "profile": "secretarytocapt3",
    "replyTo": "LIST",
    "senderId": "QYflamuPTx1bh7tzTmMdfeO3zyABTva4C-CQczME3a6uS9D4LLZtK4qiBwSkzi3R5mSfTcfwNSuNtXxA8HYMS4p3oPEhunhvo1MRouTlBtCW3O4_mQ",
    "spamInfo": {
        "isSpam": false,
        "reason": "0"
    },
    "subject": "Story Idea",
    "postDate": "1081568207",
    "msgId": 88,
    "canDelete": false,
    "contentTrasformed": false,
    "systemMessage": false,
    "headers": {
        "messageIdInHeader": "PGM1N3E0ZiszMmhpQGVHcm91cHMuY29tPg=="
    },
    "prevInTopic": 0,
    "nextInTopic": 0,
    "prevInTime": 87,
    "nextInTime": 89,
    "topicId": 88,
    "numMessagesInTopic": 1,
    "msgSnippet": "I just read about this on e-budo.com http://www.e-budo.com/vbulletin/showthread.php?s=aba2d75587ee9effb6893577877f1f35&threadid=25672 just read the",
    "rawEmail": "Return-Path: &lt;secretarytocapt3@...&gt;\r\nX-Sender: secretarytocapt3@...\r\nX-Apparently-To: SHQ_Spy_Division@yahoogroups.com\r\nReceived: (qmail 24892 invoked from network); 10 Apr 2004 03:36:51 -0000\r\nReceived: from unknown (66.218.66.167)\n  by m24.grp.scd.yahoo.com with QMQP; 10 Apr 2004 03:36:51 -0000\r\nReceived: from unknown (HELO n9.grp.scd.yahoo.com) (66.218.66.93)\n  by mta6.grp.scd.yahoo.com with SMTP; 10 Apr 2004 03:36:51 -0000\r\nReceived: from [66.218.67.176] by n9.grp.scd.yahoo.com with NNFMP; 10 Apr 2004 03:36:47 -0000\r\nDate: Sat, 10 Apr 2004 03:36:47 -0000\r\nTo: SHQ_Spy_Division@yahoogroups.com\r\nMessage-ID: &lt;c57q4f+32hi@...&gt;\r\nUser-Agent: eGroups-EW/0.82\r\nMIME-Version: 1.0\r\nContent-Type: text/plain; charset=ISO-8859-1\r\nContent-Length: 609\r\nX-Mailer: Yahoo Groups Message Poster\r\nX-eGroups-Remote-IP: 66.218.66.93\r\nFrom: &quot;Tiffany&quot; &lt;secretarytocapt3@...&gt;\r\nSubject: Story Idea\r\nX-Yahoo-Group-Post: member; u=182392907\r\nX-Yahoo-Profile: secretarytocapt3\r\n\r\nI just read about this on e-budo.com\nhttp://www.e-budo.com/vbulletin/showthread.php?s=aba2d75587ee9effb6893577877f1f35&threadid=25672\njust read the posts...very interesting mention on how Japanese police\ninterrogations were very very serious if you know what I mean.\n\nPosts concern the &quot;pragmatic&quot; relationship between law enforcement and\nthe yakuza/gangsters...\n\nIt goes way back in the movie THE WOLVES set early 20th cent. a bunch\nof gangsters try to monopolize a railroad.  And even farther back and\nwithout a doubt they wielded serious power during the time of the\nShinsengumi.\n\nShinsengumi vs Yakuza!\n\n\n\n\n"
}