{
    "userId": 108589066,
    "authorName": "Shimazu Masayoshi",
    "from": "&quot;Shimazu Masayoshi&quot; &lt;patriot014@...&gt;",
    "profile": "shimazuryu",
    "replyTo": "LIST",
    "senderId": "eIqDGLCfH4t8prpUK0hitEu7wRQBl6Q1kTlFpHI7ken0DSoeLpKh-sk4MC988OJ00IwgnN6GYMUI25k7UOCmqS-b71zabRevP-1_cOed1p1J_II",
    "spamInfo": {
        "isSpam": false,
        "reason": "0"
    },
    "subject": "The name &quot;Masayoshi&quot;",
    "postDate": "1079542374",
    "msgId": 12,
    "canDelete": false,
    "contentTrasformed": false,
    "systemMessage": false,
    "headers": {
        "messageIdInHeader": "PGMzOXZwNittYzgzQGVHcm91cHMuY29tPg=="
    },
    "prevInTopic": 0,
    "nextInTopic": 18,
    "prevInTime": 11,
    "nextInTime": 13,
    "topicId": 12,
    "numMessagesInTopic": 6,
    "msgSnippet": "Kondou actually went by the name Masayoshi for awhile, oddly enough...all the listings of his name I ve seen say Kondou Isami Masayoshi (or Kondou Isami",
    "rawEmail": "Return-Path: &lt;patriot014@...&gt;\r\nX-Sender: patriot014@...\r\nX-Apparently-To: SHQ@yahoogroups.com\r\nReceived: (qmail 83349 invoked from network); 17 Mar 2004 16:53:18 -0000\r\nReceived: from unknown (66.218.66.172)\n  by m16.grp.scd.yahoo.com with QMQP; 17 Mar 2004 16:53:18 -0000\r\nReceived: from unknown (HELO n40.grp.scd.yahoo.com) (66.218.66.108)\n  by mta4.grp.scd.yahoo.com with SMTP; 17 Mar 2004 16:53:18 -0000\r\nReceived: from [66.218.67.178] by n40.grp.scd.yahoo.com with NNFMP; 17 Mar 2004 16:52:54 -0000\r\nDate: Wed, 17 Mar 2004 16:52:54 -0000\r\nTo: SHQ@yahoogroups.com\r\nMessage-ID: &lt;c39vp6+mc83@...&gt;\r\nUser-Agent: eGroups-EW/0.82\r\nMIME-Version: 1.0\r\nContent-Type: text/plain; charset=ISO-8859-1\r\nContent-Length: 193\r\nX-Mailer: Yahoo Groups Message Poster\r\nX-eGroups-Remote-IP: 66.218.66.108\r\nFrom: &quot;Shimazu Masayoshi&quot; &lt;patriot014@...&gt;\r\nSubject: The name &quot;Masayoshi&quot;\r\nX-Yahoo-Group-Post: member; u=108589066\r\nX-Yahoo-Profile: shimazuryu\r\n\r\nKondou actually went by the name &quot;Masayoshi&quot; for awhile, oddly\nenough...all the listings of his name I&#39;ve seen say &quot;Kondou Isami\nMasayoshi&quot; (or Kondou Isami Masanobu).\n\nInteresting, huh?\n\n--M.\n\n\n"
}