{
    "userId": 185890146,
    "authorName": "secretary",
    "from": "&quot;secretary&quot; &lt;secretarytocapt3@...&gt;",
    "profile": "secretarytocapt3",
    "replyTo": "LIST",
    "senderId": "XTFBDyOp1tMiyGci8-c4leuVDucX0toSmbi02n_up_jHIarpGaPR7jPkDstR97KI_IXUdzTMd1nhm8DuGbNmptxyQcuAnoX_7ZzXJ8qKwFHH",
    "spamInfo": {
        "isSpam": false,
        "reason": "0"
    },
    "subject": "Inoue Genzaburo + Rintaro Okita Document",
    "postDate": "1101492885",
    "msgId": 1858,
    "canDelete": false,
    "contentTrasformed": false,
    "systemMessage": false,
    "headers": {
        "messageIdInHeader": "PGNvN3JxbCt0aWozQGVHcm91cHMuY29tPg=="
    },
    "prevInTopic": 0,
    "nextInTopic": 0,
    "prevInTime": 1857,
    "nextInTime": 1859,
    "topicId": 1858,
    "numMessagesInTopic": 1,
    "msgSnippet": "originally from http://8614.teacup.com/hijikata/bbs pic of document and location of discovery http://blog.drecom.jp/hinojyukuhonjin_kentoukai/ {Tama} gave a",
    "rawEmail": "Return-Path: &lt;secretarytocapt3@...&gt;\r\nX-Sender: secretarytocapt3@...\r\nX-Apparently-To: SHQ@yahoogroups.com\r\nReceived: (qmail 12581 invoked from network); 26 Nov 2004 18:16:24 -0000\r\nReceived: from unknown (66.218.66.167)\n  by m20.grp.scd.yahoo.com with QMQP; 26 Nov 2004 18:16:24 -0000\r\nReceived: from unknown (HELO n19a.bulk.scd.yahoo.com) (66.94.237.48)\n  by mta6.grp.scd.yahoo.com with SMTP; 26 Nov 2004 18:16:24 -0000\r\nReceived: from [66.218.69.1] by n19.bulk.scd.yahoo.com with NNFMP; 26 Nov 2004 18:15:06 -0000\r\nReceived: from [66.218.67.188] by mailer1.bulk.scd.yahoo.com with NNFMP; 26 Nov 2004 18:15:06 -0000\r\nDate: Fri, 26 Nov 2004 18:14:45 -0000\r\nTo: SHQ@yahoogroups.com\r\nMessage-ID: &lt;co7rql+tij3@...&gt;\r\nUser-Agent: eGroups-EW/0.82\r\nMIME-Version: 1.0\r\nContent-Type: text/plain; charset=ISO-8859-1\r\nContent-Length: 720\r\nX-Mailer: Yahoo Groups Message Poster\r\nX-Yahoo-Newman-Property: groups-compose\r\nX-eGroups-Remote-IP: 66.94.237.48\r\nFrom: &quot;secretary&quot; &lt;secretarytocapt3@...&gt;\r\nSubject: Inoue Genzaburo + Rintaro Okita Document\r\nX-Yahoo-Group-Post: member; u=185890146\r\nX-Yahoo-Profile: secretarytocapt3\r\n\r\n\noriginally from\nhttp://8614.teacup.com/hijikata/bbs\n\npic of document and location of discovery\nhttp://blog.drecom.jp/hinojyukuhonjin_kentoukai/\n\n{Tama} gave a quick summary............\n\nthe document is a {{copy}} of an original\nthe original has -not- been discovered\n\nthe document is a petiton signed when Roushi tai was formed around \nKiyokawa \n\nwhat we know now is that Inoue Genazaburo and *Rintaro Okita&#39;s names \nare on the list\n\n*Rintaro Okita was Okita Mitsu&#39;s husband.....basically Okita&#39;s \nbrother-in-law\n\nit was discovered in an old house in the Yamanashi Prefecture\n\nthe house was owned by the descendent of Hayakawa Buntaro (1st unit \nRoushi tai)\n\na historian visited the home and the {{copy}} was discovered\n\n\n\n\n"
}