{
    "userId": 108589066,
    "authorName": "Shimazu Masayoshi",
    "from": "&quot;Shimazu Masayoshi&quot; &lt;patriot014@...&gt;",
    "profile": "shimazuryu",
    "replyTo": "LIST",
    "senderId": "hsEgs2HXR8qCh3z_GP25OGiC5rMYv4BWWXXnwhPUiOPRizJIVZCCjUERgf32vqN3CtF_44fod2NPr_X-5HzOlqGgtZQe3B7fKuUbtI34Ph7-IXo",
    "spamInfo": {
        "isSpam": false,
        "reason": "0"
    },
    "subject": "Youkoso!",
    "postDate": "1079536435",
    "msgId": 1,
    "canDelete": false,
    "contentTrasformed": false,
    "systemMessage": false,
    "headers": {
        "messageIdInHeader": "PGMzOXB2ait0bHY2QGVHcm91cHMuY29tPg=="
    },
    "prevInTopic": 0,
    "nextInTopic": 2,
    "prevInTime": 0,
    "nextInTime": 2,
    "topicId": 1,
    "numMessagesInTopic": 10,
    "msgSnippet": "Youkoso, minna-sama! On behalf of everyone on the Miburo list, I would like to welcome all Miburo veterans and new members to SHQ! Though our guys may have",
    "rawEmail": "Return-Path: &lt;patriot014@...&gt;\r\nX-Sender: patriot014@...\r\nX-Apparently-To: SHQ@yahoogroups.com\r\nReceived: (qmail 41220 invoked from network); 17 Mar 2004 15:15:26 -0000\r\nReceived: from unknown (66.218.66.218)\n  by m13.grp.scd.yahoo.com with QMQP; 17 Mar 2004 15:15:26 -0000\r\nReceived: from unknown (HELO n37.grp.scd.yahoo.com) (66.218.66.105)\n  by mta3.grp.scd.yahoo.com with SMTP; 17 Mar 2004 15:15:18 -0000\r\nReceived: from [66.218.67.149] by n37.grp.scd.yahoo.com with NNFMP; 17 Mar 2004 15:13:55 -0000\r\nDate: Wed, 17 Mar 2004 15:13:55 -0000\r\nTo: SHQ@yahoogroups.com\r\nMessage-ID: &lt;c39pvj+tlv6@...&gt;\r\nUser-Agent: eGroups-EW/0.82\r\nMIME-Version: 1.0\r\nContent-Type: text/plain; charset=ISO-8859-1\r\nContent-Length: 741\r\nX-Mailer: Yahoo Groups Message Poster\r\nX-eGroups-Remote-IP: 66.218.66.105\r\nFrom: &quot;Shimazu Masayoshi&quot; &lt;patriot014@...&gt;\r\nSubject: Youkoso!\r\nX-Yahoo-Group-Post: member; u=108589066\r\nX-Yahoo-Profile: shimazuryu\r\n\r\nYoukoso, minna-sama! On behalf of everyone on the Miburo list, I would\nlike to welcome all Miburo veterans and new members to SHQ! Though\n&quot;our&quot; guys may have departed from this world in a blaze of glory, they\nhave been condemned to relative ignominy. It would seem, however, that\nthe Japanese public is rediscovering their value, and we who are\noutside of Japan have learned of their reknown. This group will, among\nother things, help to further the knowledge of the Shinsengumi in the\nworld. Although, as the description indicated, we also enjoy simply\nbeing Shinsengumi otaku...^_^\n\n--Shimazu Masayoshi\n\nP.S. Irony of ironies, huh? A Shimazu in a Shinsengumi group...but\nwe&#39;ll leave that for the historical details that&#39;ll be posted soon.\n\n\n"
}