{
    "userId": 122717733,
    "authorName": "Grace Battista",
    "from": "&quot;Grace Battista&quot; &lt;mg_batt@...&gt;",
    "profile": "mg_batt",
    "replyTo": "LIST",
    "senderId": "h3eNLvqDt-sDxUYxUejO3wYmDbgFjMgJ7YEw3QyGnYI1kIhawJ7ckKQwLIMwJM0WRzo3Vx4uBLpLiUllWjXVo5j2cEgFas9vmHrY",
    "spamInfo": {
        "isSpam": false,
        "reason": "0"
    },
    "subject": "Hello everyone!",
    "postDate": "1079642105",
    "msgId": 38,
    "canDelete": false,
    "contentTrasformed": false,
    "systemMessage": false,
    "headers": {
        "messageIdInHeader": "PGMzZDE1cCtuaGk3QGVHcm91cHMuY29tPg=="
    },
    "prevInTopic": 0,
    "nextInTopic": 0,
    "prevInTime": 37,
    "nextInTime": 39,
    "topicId": 38,
    "numMessagesInTopic": 1,
    "msgSnippet": "Hello everyone! I ve joined the new list.... Sorry if this post will be short and uninformative... Just wanted to let everyone know I m glad there s a new list",
    "rawEmail": "Return-Path: &lt;mg_batt@...&gt;\r\nX-Sender: mg_batt@...\r\nX-Apparently-To: SHQ@yahoogroups.com\r\nReceived: (qmail 62167 invoked from network); 18 Mar 2004 20:36:28 -0000\r\nReceived: from unknown (66.218.66.217)\n  by m15.grp.scd.yahoo.com with QMQP; 18 Mar 2004 20:36:28 -0000\r\nReceived: from unknown (HELO n3.grp.scd.yahoo.com) (66.218.66.86)\n  by mta2.grp.scd.yahoo.com with SMTP; 18 Mar 2004 20:36:28 -0000\r\nReceived: from [66.218.66.141] by n3.grp.scd.yahoo.com with NNFMP; 18 Mar 2004 20:35:07 -0000\r\nDate: Thu, 18 Mar 2004 20:35:05 -0000\r\nTo: SHQ@yahoogroups.com\r\nMessage-ID: &lt;c3d15p+nhi7@...&gt;\r\nUser-Agent: eGroups-EW/0.82\r\nMIME-Version: 1.0\r\nContent-Type: text/plain; charset=ISO-8859-1\r\nContent-Length: 291\r\nX-Mailer: Yahoo Groups Message Poster\r\nX-eGroups-Remote-IP: 66.218.66.86\r\nFrom: &quot;Grace Battista&quot; &lt;mg_batt@...&gt;\r\nSubject: Hello everyone!\r\nX-Yahoo-Group-Post: member; u=122717733\r\nX-Yahoo-Profile: mg_batt\r\n\r\nHello everyone! I&#39;ve joined the new list.... Sorry if this post will \nbe short and uninformative... Just wanted to let everyone know I&#39;m \nglad there&#39;s a new list and that after I return to the country after \nthis vacation of mine, I&#39;ll be posting better stuff. See you all! \nHopefully soon.\n\n\n"
}