{
    "userId": 173227807,
    "authorName": "spiritus saitou",
    "from": "spiritus saitou &lt;spiritus_saitou@...&gt;",
    "profile": "spiritus_saitou",
    "replyTo": "LIST",
    "senderId": "6sMNxTcSKDOpZ_RAFB-WGL5NK4KOBEee_HCdyfLmv_iNunEnmeCamrNTQDyc0raXpHVwUA6owKlNcPthmh03waxXfOa89gqy8scz6wkgzPUtXw",
    "spamInfo": {
        "isSpam": false,
        "reason": "0"
    },
    "subject": "Like duh",
    "postDate": "1079665740",
    "msgId": 44,
    "canDelete": false,
    "contentTrasformed": false,
    "systemMessage": false,
    "headers": {
        "messageIdInHeader": "PDIwMDQwMzE5MDMwOTAwLjczMzg3LnFtYWlsQHdlYjIxNDA4Lm1haWwueWFob28uY29tPg=="
    },
    "prevInTopic": 0,
    "nextInTopic": 0,
    "prevInTime": 43,
    "nextInTime": 45,
    "topicId": 44,
    "numMessagesInTopic": 1,
    "msgSnippet": "See what you did to me?  I just now noticed his name in your post.  Sheesh... clueless Do you Yahoo!? Yahoo! Mail - More reliable, more storage, less spam ",
    "rawEmail": "Return-Path: &lt;spiritus_saitou@...&gt;\r\nX-Sender: spiritus_saitou@...\r\nX-Apparently-To: shq@yahoogroups.com\r\nReceived: (qmail 78270 invoked from network); 19 Mar 2004 03:09:00 -0000\r\nReceived: from unknown (66.218.66.167)\n  by m3.grp.scd.yahoo.com with QMQP; 19 Mar 2004 03:09:00 -0000\r\nReceived: from unknown (HELO web21408.mail.yahoo.com) (216.136.232.78)\n  by mta6.grp.scd.yahoo.com with SMTP; 19 Mar 2004 03:09:00 -0000\r\nMessage-ID: &lt;20040319030900.73387.qmail@...&gt;\r\nReceived: from [130.13.110.254] by web21408.mail.yahoo.com via HTTP; Thu, 18 Mar 2004 19:09:00 PST\r\nDate: Thu, 18 Mar 2004 19:09:00 -0800 (PST)\r\nTo: shq@yahoogroups.com\r\nMIME-Version: 1.0\r\nX-eGroups-Remote-IP: 216.136.232.78\r\nFrom: spiritus saitou &lt;spiritus_saitou@...&gt;\r\nSubject: Like duh\r\nX-Yahoo-Group-Post: member; u=173227807\r\nX-Yahoo-Profile: spiritus_saitou\r\nContent-Type: text/plain; charset=US-ASCII\r\nContent-Transfer-Encoding: 7bit\r\n\r\nSee what you did to me?  I just now noticed his name in your post.  Sheesh...\n \nclueless\n\nDo you Yahoo!?\nYahoo! Mail - More reliable, more storage, less spam\n\n[Non-text portions of this message have been removed]\n\n\n"
}