{
    "userId": 176343463,
    "authorName": "Tiffany",
    "from": "&quot;Tiffany&quot; &lt;makoto@...&gt;",
    "profile": "secretarytocapt3",
    "replyTo": "LIST",
    "senderId": "UYsSXARJggf2du74Kd5EsVRUSS-RYvlOeTkui47HdBIoN4inMMe5vqQc7MF8F5ZK0oe1j91GNKgE2YVz33DCQHV5T3KUQCJKFrY",
    "spamInfo": {
        "isSpam": false,
        "reason": "0"
    },
    "subject": "March 21st Aizu---be there!",
    "postDate": "1079813617",
    "msgId": 69,
    "canDelete": false,
    "contentTrasformed": false,
    "systemMessage": false,
    "headers": {
        "messageIdInHeader": "PGMzaThsaCszZnVwQGVHcm91cHMuY29tPg=="
    },
    "prevInTopic": 0,
    "nextInTopic": 0,
    "prevInTime": 68,
    "nextInTime": 70,
    "topicId": 69,
    "numMessagesInTopic": 1,
    "msgSnippet": "Well, if any of you are planning for a trip to Japan you may want to plan it so that when you visit Aizu you are there when they are having a festival... Aizu",
    "rawEmail": "Return-Path: &lt;makoto@...&gt;\r\nX-Sender: makoto@...\r\nX-Apparently-To: SHQ@yahoogroups.com\r\nReceived: (qmail 33385 invoked from network); 20 Mar 2004 20:13:47 -0000\r\nReceived: from unknown (66.218.66.216)\n  by m4.grp.scd.yahoo.com with QMQP; 20 Mar 2004 20:13:47 -0000\r\nReceived: from unknown (HELO n31.grp.scd.yahoo.com) (66.218.66.99)\n  by mta1.grp.scd.yahoo.com with SMTP; 20 Mar 2004 20:13:47 -0000\r\nReceived: from [66.218.66.140] by n31.grp.scd.yahoo.com with NNFMP; 20 Mar 2004 20:13:38 -0000\r\nDate: Sat, 20 Mar 2004 20:13:37 -0000\r\nTo: SHQ@yahoogroups.com\r\nMessage-ID: &lt;c3i8lh+3fup@...&gt;\r\nUser-Agent: eGroups-EW/0.82\r\nMIME-Version: 1.0\r\nContent-Type: text/plain; charset=ISO-8859-1\r\nContent-Length: 399\r\nX-Mailer: Yahoo Groups Message Poster\r\nX-eGroups-Remote-IP: 66.218.66.99\r\nFrom: &quot;Tiffany&quot; &lt;makoto@...&gt;\r\nSubject: March 21st Aizu---be there!\r\nX-Yahoo-Group-Post: member; u=176343463\r\nX-Yahoo-Profile: secretarytocapt3\r\n\r\nWell, if any of you are planning for a trip to Japan you may want to\nplan it so that when you visit Aizu you are there when they are having\na festival...\n\nAizu higan shishi\n21 March\nAizu wakamatsu, Fukushima Prefecture\nLion dances are performed around the city marking the end of the long\nwinter and the Buddhist services of the equinoctial week.\n\nSource....http://japanvisitor.com/jc/mar_fest.html\n\n\n"
}