{
    "userId": 173227807,
    "authorName": "spiritus saitou",
    "from": "spiritus saitou &lt;spiritus_saitou@...&gt;",
    "profile": "spiritus_saitou",
    "replyTo": "LIST",
    "senderId": "GRViU8Fi2eH05Giy_3l7EI36_SRjR9ESYXDPzZfkeWzFP-Lssl29wlYsG02chvyilXrJSQm7In50H9QjhOHC6SZfHdmHNKvv6J7O4k9ygfdTKA",
    "spamInfo": {
        "isSpam": false,
        "reason": "0"
    },
    "subject": "List and personal calendars",
    "postDate": "1079833487",
    "msgId": 72,
    "canDelete": false,
    "contentTrasformed": false,
    "systemMessage": false,
    "headers": {
        "messageIdInHeader": "PDIwMDQwMzIxMDE0NDQ3LjEzMjM3LnFtYWlsQHdlYjIxNDA0Lm1haWwueWFob28uY29tPg=="
    },
    "prevInTopic": 0,
    "nextInTopic": 0,
    "prevInTime": 71,
    "nextInTime": 73,
    "topicId": 72,
    "numMessagesInTopic": 1,
    "msgSnippet": "A heads-up.  Apparently times are not converted when the entry is imported (at least to a personal Yahoo calendar)... it s still listed in EST.  6:00AM EST",
    "rawEmail": "Return-Path: &lt;spiritus_saitou@...&gt;\r\nX-Sender: spiritus_saitou@...\r\nX-Apparently-To: shq@yahoogroups.com\r\nReceived: (qmail 25886 invoked from network); 21 Mar 2004 01:44:48 -0000\r\nReceived: from unknown (66.218.66.218)\n  by m6.grp.scd.yahoo.com with QMQP; 21 Mar 2004 01:44:48 -0000\r\nReceived: from unknown (HELO web21404.mail.yahoo.com) (216.136.232.74)\n  by mta3.grp.scd.yahoo.com with SMTP; 21 Mar 2004 01:44:47 -0000\r\nMessage-ID: &lt;20040321014447.13237.qmail@...&gt;\r\nReceived: from [130.13.110.254] by web21404.mail.yahoo.com via HTTP; Sat, 20 Mar 2004 17:44:47 PST\r\nDate: Sat, 20 Mar 2004 17:44:47 -0800 (PST)\r\nTo: shq@yahoogroups.com\r\nMIME-Version: 1.0\r\nX-eGroups-Remote-IP: 216.136.232.74\r\nFrom: spiritus saitou &lt;spiritus_saitou@...&gt;\r\nSubject: List and personal calendars\r\nX-Yahoo-Group-Post: member; u=173227807\r\nX-Yahoo-Profile: spiritus_saitou\r\nContent-Type: text/plain; charset=US-ASCII\r\nContent-Transfer-Encoding: 7bit\r\n\r\nA heads-up.  Apparently times are not converted when the entry is imported (at least to a personal Yahoo calendar)... it&#39;s still listed in EST.  6:00AM EST doesn&#39;t do me much good when that&#39;s 4:00AM where I&#39;m at.  :-)  Just thought you should be aware.  Check your local schedules if you see something you really want to watch!  (Unless someone else has figured out how to make it convert... I&#39;m always missing places where I should click...)\n \npachi\n\nDo you Yahoo!?\nYahoo! Finance Tax Center - File online. File on time.\n\n[Non-text portions of this message have been removed]\n\n\n"
}