{
    "userId": 1533100,
    "authorName": "Barbara Sheridan",
    "from": "Barbara Sheridan &lt;bsher213@...&gt;",
    "profile": "bsher213",
    "replyTo": "LIST",
    "senderId": "NR348HDON3afgxymqOFQydFKPZlco7weFRpZ-Ta-Xy6tI_Qn8cXgsFsAH25DDI66HcWMWkTiCKz0QURx8tX9nrp1PEGhBeIlMcP1Q5Zhi-rYndE",
    "spamInfo": {
        "isSpam": false,
        "reason": "0"
    },
    "subject": "If only",
    "postDate": "1079922416",
    "msgId": 83,
    "canDelete": false,
    "contentTrasformed": false,
    "systemMessage": false,
    "headers": {
        "messageIdInHeader": "PDQwNUU0RUYwLjEwNjA1MDdAYmVsbGF0bGFudGljLm5ldD4="
    },
    "prevInTopic": 0,
    "nextInTopic": 0,
    "prevInTime": 82,
    "nextInTime": 84,
    "topicId": 83,
    "numMessagesInTopic": 1,
    "msgSnippet": "Ever wonder what might have happened had the Japanese dealt differently with Perry when he landed there? Check out this Today in Alternate History chronicle of",
    "rawEmail": "Return-Path: &lt;bsher213@...&gt;\r\nX-Sender: bsher213@...\r\nX-Apparently-To: SHQ@yahoogroups.com\r\nReceived: (qmail 86951 invoked from network); 22 Mar 2004 02:26:51 -0000\r\nReceived: from unknown (66.218.66.218)\n  by m12.grp.scd.yahoo.com with QMQP; 22 Mar 2004 02:26:51 -0000\r\nReceived: from unknown (HELO out012.verizon.net) (206.46.170.137)\n  by mta3.grp.scd.yahoo.com with SMTP; 22 Mar 2004 02:26:51 -0000\r\nReceived: from bellatlantic.net ([68.162.182.7]) by out012.verizon.net\n          (InterMail vM.5.01.06.06 201-253-122-130-106-20030910) with ESMTP\n          id &lt;20040322022650.YXTV18295.out012.verizon.net@...&gt;\n          for &lt;SHQ@yahoogroups.com&gt;; Sun, 21 Mar 2004 20:26:50 -0600\r\nMessage-ID: &lt;405E4EF0.1060507@...&gt;\r\nDate: Sun, 21 Mar 2004 21:26:56 -0500\r\nUser-Agent: Mozilla/5.0 (Windows; U; Windows NT 5.1; en-US; rv:1.4) Gecko/20030624 Netscape/7.1 (ax)\r\nX-Accept-Language: en-us, en, ja\r\nMIME-Version: 1.0\r\nTo: SHQ@yahoogroups.com\r\nContent-Type: text/plain; charset=us-ascii; format=flowed\r\nContent-Transfer-Encoding: 7bit\r\nX-Authentication-Info: Submitted using SMTP AUTH at out012.verizon.net from [68.162.182.7] at Sun, 21 Mar 2004 20:26:47 -0600\r\nX-eGroups-Remote-IP: 206.46.170.137\r\nFrom: Barbara Sheridan &lt;bsher213@...&gt;\r\nSubject: If only\r\nX-Yahoo-Group-Post: member; u=1533100\r\nX-Yahoo-Profile: bsher213\r\n\r\nEver wonder what might have happened had the Japanese dealt differently \nwith Perry when he landed there? Check out this Today in Alternate \nHistory chronicle of possible events.\n\nhttp://www.othertimelines.com/viewtimeline.php?timelineID=333\n\n-- \nBarbara Sheridan\t\n\nhttp://www.barbarasheridan.net\n\n\n\n\n"
}